{"format": "org.openmixer.preset/2", "plugin": {"id": "urn:fake:lv2", "version": "0.3", "fingerprint": "omx-layout/1:0000000000000000000000000000000000000000000000000000000000000000"},
 "id": "lead", "name": "Lead", "carries": "params+state", "params": [{"symbol": "cutoff", "value": 0.1}],
 "state": {"encoding": "base64", "context": "lv2", "bytes": "AAEC", "files": [{"name": "sample.wav", "encoding": "base64", "bytes": "UklGRg=="}]}}
